Product,Site,URL,Review
poco c75,gsmarena.com,https://www.gsmarena.com/poco_c75_5g_hands_on-review-2782.php,"Dec 31, 2024 · The Poco C75 5G is the newest entry-level model in the company's lineup and the successor to last year's C65. The C75 is essentially a rebranded version of the Xiaomi A4 with very minimal ... Mar 24, 2025 · With a weight of around 204 g, the Poco C75 feels comfortable to hold and carry, making it suitable for everyday use. The Poco C75 offers a diverse range of color options to choose from. The Nano SIM's compact size allows mobile device manufacturers to design slimmer and more compact devices. Jan 17, 2025 · We used the new Poco C75 5G for a week, here is our in-depth review of the smartphones. The device is currently priced at Rs 7,999. Nov 21, 2024 · Xiaomi Poco C75 comes with IPS LCD, 120Hz, 450 nits (typ), and 600 nits (HBM), It offers a size of 6.88 inches, 112.4 cm2 (~84.0% screen-to-body ratio) that is suitable for browsing the internet, playing games and watching videos, and it comes with a resolution of 720 x 1640 pixels (~260 ppi density). Xiaomi Poco C75 advantages Dec 31, 2024 · Here’s my review of the POCO C75 5G, covering its design, performance, camera, battery, and whether it’s worth the price. Oct 26, 2024 · The Poco C75 is Xiaomi’s latest budget phone and has a sleek and efficient design with a focus on practicality. It has a flat display and a circular camera module at the back and is for those who want both style and functionality. Is Poco C75 a 5G phone? Here’s my review of the POCO C75 5G, covering its design, performance, camera, battery, and whether it’s worth the price. Poco has launched its new budget smartphone — one of the most affordable 5G phones in India — the Poco C75 , priced at Rs 8,499. Is it really a 5G phone though? How much does a poco C75 weigh? With a weight of around 204 g , the Poco C75 feels comfortable to hold and carry, making it suitable for everyday use. The Poco C75 offers a diverse range of color options to choose from. The Nano SIM's compact size allows mobile device manufacturers to design slimmer and more compact devices. Is the Poco C75 worth buying? I have been using the Poco C75 for almost 10 days now and it comes with a large display, decent cameras, solid build quality and passable performance. One of the best things about this phone though is its overall in-hand feel and looks — quite good for the price. Is it worth buying though? And, what's the whole 5G mess? Is the Poco C75 a good camera? The Poco C75's IPS display combines excellent color accuracy, sharpness, wide viewing angles, and eye-friendly features. If you have minimal photography requirements and are looking for a budget-friendly device, the single-camera setup on the Poco C75 can be acceptable . Rated 3 /5 based on 152 user votes. Does Poco C75 5G have a plastic case? The absence of a plastic case inside the box is a letdown, but given the device’s affordable price, we can let it slide. Poco C75 5G is available in 3 colour schemes – Aqua Bliss, Enchanted Green, and Silver Stardust. All three colour variants have a marble flow design on the back panel. Does Poco C75 5G lag? Poco C75 5G Review. Being a mobile gamer, I put this phone to the test by playing BGMI for about an hour. I played on Smooth + Ultra graphics, which supports up to 40 FPS, and while there were occasional frame drops of up to 15 FPS, I didn’t experience any lag . Dec 21, 2024 · As a competent entry-level smartphone, the Xiaomi Poco C75 5G boasts notable features such as a 120Hz display, good build quality, and an impressive battery life."
poco c75,gsmarena.com,https://www.gsmarena.com/xiaomi_poco_c75-reviews-13435.php,GSMArena.com: Xiaomi Poco C75 user opinions and reviews
poco c75,smartprix.com,https://www.smartprix.com/mobiles/poco-c75-5g-ppd1bn1s1qyi,"Poco C75 5G Specs · 6.88 inch, LCD ScreenLargest · 720 x 1650 pixelsGood · 262 ppiPoor · Brightness: 600 nits, TÜV low blue light certification TÜV flicker-free ..."
poco c75,gsmarena.com,https://www.gsmarena.com/poco_c75_5g_in_for_review-news-65860.php,"On the inside, the Poco C75 is running on the Qualcomm ... We are currently working on our review of the Poco C75 , which should be out soon."
poco c75,gsmarena.com,https://www.gsmarena.com/newscomm-65860.php,Poco C75 5G in for review Comments ... I just remember they made the article in for review and didnt see the review of it mentioned after like few ...
poco c75,smartprix.com,https://www.smartprix.com/mobiles/xiaomi_redmi_note_13_5g_vs_poco_c75_8gb_ram_256gb_-cpd1y4yzrj6s_pd1j19ejk4i.php,Here you can compare Poco C 75 (8GB RAM + 256GB) and Xiaomi Redmi Note 13 5G.
redmi 9A,gsmarena.com,https://www.gsmarena.com/xiaomi_redmi_9a-reviews-10279.php,"Been using my Redmi 9A (32gb / 1) phone for 1 and half year for school purposes. Trust me, it will test your patience. I can't even open another tab because it lags everytime. The only good thing about this phone is it has a large battery capacity and has a large display ."
redmi 9A,gadgets360.com,https://www.gadgets360.com/redmi-9a-price-in-india-95225/user-reviews,"Xiaomi Redmi 9A mobile with 6.53-inch 720x1600 display powered by MediaTek Helio G25 processor alongside 2GB of RAM and 13-megapixel rear camera. 3.9☆ 9,001 ..."
redmi 9A,smartprix.com,https://www.smartprix.com/mobiles/xiaomi-redmi-9a-ppd1nfqoi6gv,"You can check the price history of Xiaomi Redmi 9A below. The current price is ₹7,999. Over the past month, there has been a increase of ₹1,426 in the price."
redmi 9A,gsmarena.com,https://www.gsmarena.com/xiaomi_redmi_9a-reviews-10279p14.php,"I kinda gave up and took on a Samsung Phone and kept the 9A as a backup. And even after I cleared out a lot of Apps from it, and only using it to read novels. That damn thing still lags! It was so bad I gave up. Its now sitting in my office doing nothing. I was hoping to donate it, but considering how laggy it is. I didnt want to impose that frustration on others. ... Total of 675 user reviews and opinions for Xiaomi Redmi ..."
mi,gsmarena.com,https://www.gsmarena.com/xiaomi_mi_4-reviews-6518p8.php,Install MIUI version 6.10.13. Battery least longest on it. Up to 6h SOT on 5-6 days standby. No bugs founded. ... Total of 2728 user reviews and opinions for Xiaomi Mi 4.
mi,gsmarena.com,https://www.gsmarena.com/xiaomi_mi_4c-reviews-7512p3.php,"Recently at nougat miui 8 stable. Miui 9 coming, currently in beta channel. Been using this phone for 1 year now. SOT about 4.5 hours in nougat. Really good phone, definitely better than any redmi series in term of performance. ... Total of 691 user reviews and opinions for Xiaomi Mi 4c."
mi,gsmarena.com,https://www.gsmarena.com/xiaomi_mi_11-review-2228.php,Xiaomi Mi 11 review ... Reviews Xiaomi Mi 11 review ... Xiaomi Mi 11 review - Reader comments
mi,techradar.com,https://www.techradar.com/news/best-xiaomi-phones,7 Aug 2025 — The Xiaomi 15 Ultra occupies our current top spot thanks to its exceptional performance and truly unique cameras.
mi,gadgets360.com,https://www.gadgets360.com/laptops/reviews/mi-notebook-ultra-review-price-india-xiaomi-laptops-2598673,"3 Nov 2021 — Mi Notebook Ultra Laptop · Good · High-res 90Hz 16:10 display · Comfortable keyboard · Relatively portable, well built · Good overall ..."
poco,techradar.com,https://www.techradar.com/phones/xiaomi-phones/xiaomi-poco-x7-pro-review,"It’s not going to impress camera phone fans and you’ll have to wait for a few of its software features, but despite those setbacks, the Poco X7 Pro presents a solid package at a low price. ... Why you can trust TechRadar We spend hours testing every product or service we review , so you can ... A fiercely competitive budget phone"
poco,gadgets360.com,https://www.gadgets360.com/poco-f1-5591/user-reviews,"User Ratings for Poco F1 and User Reviews for Poco F1 at Gadgets 360. Do you agree with the responses? or Was this review helpful to You? You can easily share your opinions, vote for each Poco F1 user review and rating."
poco,techradar.com,https://www.techradar.com/reviews/xiaomi-poco-x3-nfc,"The Poco X3 NFC comes with a few features you might expect of a pricier Android handset, such as decent gaming performance thanks to its Snapdragon G-series processor and a 120Hz screen, with excellent battery life sealing the deal. This is a great option for those on a budget. ... Why you can trust TechRadar We spend hours testing every product or service we review ... A lot of phone for not very much cash"
poco,gsmarena.com,https://www.gsmarena.com/poco_c65_in_for_review-news-60532.php,"November 11, 2023 - Poco 's new entry-level herp is here. We have the new Poco C65 in for review so let's do an unboxing. The phone comes in a modest package with only a USB..."
poco,gsmarena.com,https://www.gsmarena.com/poco_f6-review-2706.php,"We will continue to refer to the handset as Poco F6 throughout this review , but all review findings should apply to the Redmi Turbo 3 as well."
poco,gsmarena.com,https://www.gsmarena.com/poco_f4-review-2443.php,"Well, we are intrigued to see what this Poco F4 has to offer, especially now that we've reviewed the higher-tier Poco F4 GT."
poco,gsmarena.com,https://www.gsmarena.com/poco_x6_pro-review-2653.php,Poco X6 Pro review ... Reviews Poco X6 Pro review ... Poco X6 Pro review - Reader comments
poco,gsmarena.com,https://www.gsmarena.com/poco_watch_review_-news-54377.php,Our review unit comes in black but you can also pick up the Poco Watch in blue and ivory colors with color-matched straps.
poco,gadgets360.com,https://www.gadgets360.com/mobiles/reviews/poco-f6-review-5896509,"Poco F6 Review : Excellent Performance, Mid Range Cameras ... Poco F6 is a mid-range phone that competes with the likes of the new Realme GT 6T , Vivo ..."
poco,gadgets360.com,https://www.gadgets360.com/mobiles/reviews/poco-x6-pro-review-4871021,Poco X6 Pro Review : Total Bang for the Buck ... Read detailed Poco X6 Pro review ... Poco M7 5G Review : Familiar Territory
poco,gadgets360.com,https://www.gadgets360.com/poco-c75-5g-price-in-india-129610,"See full specifications, expert reviews , user ratings, and more. Compare Poco C75 5G prices before buying online."
cmf by nothing phone 1,tomsguide.com,https://www.tomsguide.com/phones/android-phones/cmf-phone-1-review-a-refreshingly-different-kind-of-budget-phone,"Due to its low cost, the CMF Phone 1 is constructed primarily out of plastic. I’m not terribly surprised by this because all of the small design choices Nothing makes give it an original look that’s unlike anything else out there. For starters, the plastic body of my light green review unit ... You won't find other cheap phones that look like this"
cmf by nothing phone 1,gsmarena.com,https://www.gsmarena.com/nothing_cmf_phone_1-review-2719p4.php,"The CMF Phone 1 is not afraid of its Nothing roots. On the contrary, as we mentioned, Nothing views the CMF Phone 1 as another entryway into the broader..."
cmf by nothing phone 1,gsmarena.com,https://www.gsmarena.com/nothing_cmf_phone_1-review-2719.php,Nothing is a relatively new brand itself but their subbrand - CMF - is even more recent and so far limited itself to offering smartphone accessories with...
cmf by nothing phone 1,amazon.in,https://www.amazon.in/CMF-Expandable-Dimensity-Processor-Charging/dp/B0D933D6Z4,"CMF by Nothing Phone 1 5G (Blue, 6GB RAM, 128GB Storage) | Expandable Upto 2 TB | 50MP+2MP | 16MP Front Camera | Dimensity 7300 5G Processor | 6.67 AMOLED Display | 33W Fast Charging | Designed 2 Last : Amazon.in: Electronics"
cmf by nothing phone 1,91mobiles.com,https://www.91mobiles.com/hub/cmf-phone-1-review/,"You can download this app, developed by Nothing Technology Ltd, from the Google Play Store to ensure uniformity. Nothing has promised two years of major software updates and an additional year of security updates for the device, which is standard. The CMF Phone 1 comes with a 5,000mAh battery, ..."
cmf by nothing phone 1,gadgets360.com,https://www.gadgets360.com/mobiles/reviews/cmf-phone-1-review-6168808,"30 Jul 2024 — The CMF Phone 1 offers excellent performance, design, and battery life . However, will it be able to survive the competition? Check out the review!"
cmf by nothing phone 1,flipkart.com,https://www.flipkart.com/cmf-nothing-phone-1-black-128-gb/product-reviews/itmeef68c7ce70bf?pid=MOBHYBQTGGEGGA2B&lid=LSTMOBHYBQTGGEGGA2BCRTZZY&sortOrder=MOST_HELPFUL&certifiedBuyer=false&aid=dc0f2b2d-7619-44cc-b5fc-2fe3e4d453a7,"+ 1616. CMF by Nothing Phone 1 (Black, 128 GB) Reviews ....Best phone in this budget The camera quality of this phone is very good. Read more. Ruma mahata."
cmf by nothing phone 1,amazon.in,https://www.amazon.in/CMF-NOTHING-Phone-128-Blue/dp/B0D935TRB5,"CMF BY NOTHING Phone 1 5G Mobile Phone Information. Technical Details.Battery life receives mixed reviews , with some customers reporting good performance while others experience issues with the phone stopping charging."
cmf by nothing phone 1,flipkart.com,https://www.flipkart.com/cmf-nothing-phone-1-5g/p/itm9bfa0dd29dbcb,"India's biggest online store for Mobiles, Fashion (Clothes/Shoes), Electronics, Home Appliances, Books, Home, Furniture, Grocery, Jewelry, Sporting goods, Beauty & Personal Care and more! Find the largest selection from all brands at the lowest prices in India."
i phone 16,flipkart.com,https://www.flipkart.com/mobile-phones-store,"Buy mobile phones at best prices. Flipkart is the right platform for you to look for a mobile phone that fits your budget, technical and design requirements as we have phones ranging from Rs …"
i phone 16,tomsguide.com,https://www.tomsguide.com/best-picks/best-phones,These are the best phones you can buy at a wide range of prices based on our extensive testing and head-to-head comparisons.
i phone 16,gadgets360.com,https://www.gadgets360.com/mobiles/reviews/iphone-16-plus-review-6834678,21 Oct 2024 — iPhone 16 Plus · Good · Stunning display · Solid build quality and lovely colour options · Battery life is bonkers on this one · Excellent for ...
i phone 16,tomsguide.com,https://www.tomsguide.com/phones/iphones/apple-iphone-16-review,"Sharing more of the same features found on the Pro models than ever before, the iPhone 16 proves that, pound-for-pound, it's one of the best contenders for best phone, with its stylish looks,..."
i phone 16,techradar.com,https://www.techradar.com/phones/iphone/iphone-16-review,"Sep 18, 2024 · For the starting price, the iPhone 16 offers responsive performance to compete with rivals like the Galaxy S24 or Pixel 9. It’s not a night-and-day improvement over the iPhone 15 for say, video..."
i phone 16,tomsguide.com,https://www.tomsguide.com/phones/iphones/i-just-spent-my-first-week-with-the-iphone-16-pro-max-the-ups-and-the-downs,"October 7, 2024 - I wasn't lucky enough to get an iPhone 16 Pro Max on launch day, but seven days ago it finally appeared at my door. I already had a good idea of what to expect when it did arrive thanks to Tom's Guide's reviews and hands-ons with the different models and their new features, but now I've had ..."
Samsung Discover the Latest,tomsguide.com,https://www.tomsguide.com/best-picks/best-samsung-phone,"1 month ago - You really have to be swayed by the thin look of the Edge to justify that cost, since other features — including performance and Galaxy AI support — are identical. Read our full Samsung Galaxy S25 Edge review . ... U.S. shoppers can now discover what people in the U.K."
Samsung Discover the Latest,gadgets360.com,https://www.gadgets360.com/samsung/reviews,"Aug 9, 2025 · Get the latest samsung reviews headlines including analysis on top samsung reviews , stories, photos and more on samsung."
Samsung Discover the Latest,tomsguide.com,https://www.tomsguide.com/,Samsung 's latest buds are bringing some great specs and Galaxy AI to a more affordable price point.
Samsung Discover the Latest,techradar.com,https://www.techradar.com/news/best-samsung-phones,"February 17, 2025 - Our guide to the best Samsung phones features models for all budgets and use cases."
Samsung Discover the Latest,gsmarena.com,https://www.gsmarena.com/samsung_galaxy_discover_s730m-reviews-5111.php,Total of 298 user reviews and opinions for Samsung Galaxy Discover S730M. ... These are the best offers from our affiliate partners.
cmf by nothin phone 1,smartprix.com,https://www.smartprix.com/mobiles/nothing_phone_1_vs_reach_champ_fm-cpd173vzooh3_1101nx97edc.php,"Reach Champ FM. Nothing Phone 1 . OS. Android v12.Nothing’s sub-brand CMF (Colour Material Finish) is shaking up the Indian smartphone market with its first release, the CMF Phone 1 . Tailored for budget-conscious buyers, this phone is all about eye-catching …"
Google Pixel phone since,techradar.com,https://www.techradar.com/news/best-pixel-phones,"April 10, 2025 - The Pixel 9 Pro and Pixel 9 Pro XL are essentially identical, so both of them would be the best Pixel phone to buy in 2025. I appreciate that Google didn't skimp on features with the smaller Pixel 9 Pro and I want to encourage this so I'm naming the Pixel 9 Pro the Best Pixel Overall."
Google Pixel phone since,tomsguide.com,https://www.tomsguide.com/phones/google-pixel-phones/google-pixel-9a-review,"Google Pixel 8a - Unlocked Android... Google Pixel 8a - Unlocked Android Phone with Google AI, Advanced Pixel Camera and 24-Hour Battery - Bay - 128 GB ... John’s a senior editor covering phones for Tom’s Guide. He’s no stranger in this area having covered mobile phones and gadgets since 2008 ... This is how you do a budget phone right"
Google Pixel phone since,techradar.com,https://www.techradar.com/phones/google-pixel-phones/google-pixel-10-review,"The Google Pixel 10 takes a winning formula from last year and adds just enough to make it even more compelling, and make this phone a true competitor to the iPhone 16. In the past, Google 's phones have been polished and enjoyable, but never cutting edge."
Google Pixel phone since,tomsguide.com,https://www.tomsguide.com/phones/live/made-by-google-2025-live-updates-pixel-10-pixel-watch-4-and-all-the-last-minute-rumors,"google pixel 9 review shots of phone .Made by Google 2025: Biggest expected announcements. Pixel 10: New entry-level flagship phone , now with a telephoto lens. Pixel 10 Pro: 6.3-inch version of Google 's Pro phone , with improved screen and bigger battery."
samsung s25,gadgets360.com,https://www.gadgets360.com/mobiles/reviews/samsung-galaxy-s25-and-galaxy-s25-plus-review-7775355,"24 Feb 2025 — Both phones support up to 8K@60fps video recording , and the quality is top-notch. The selfie cameras on S25 and S25+ do a great job, and I had ..."
samsung s25,techradar.com,https://www.techradar.com/phones/samsung-galaxy-phones/samsung-galaxy-s25-review,"Feb 7, 2025 · After three years making essentially the same phone, you’d hope and expect that Samsung would really nail it this time around, and it has. The Galaxy S25 is better than its predecessors in..."
samsung s25,tomsguide.com,https://www.tomsguide.com/phones/samsung-phones/galaxy-s25-review,"Aug 12, 2025 · While a lot of the Galaxy S25 may be familiar, it upgrades enough and adds many new AI features to make this compact flagship phone one of the best deals in its category."
samsung s25,gsmarena.com,https://www.gsmarena.com/samsung_galaxy_s25-reviews-13610p27.php,Total of 576 user reviews and opinions for Samsung Galaxy S25 .
samsung s25,techradar.com,https://www.techradar.com/phones/samsung-galaxy-phones/samsung-galaxy-s25-plus-review,The Plus gets ultra battery life and an ultra display
i phone 16 pro max,techradar.com,https://www.techradar.com/phones/iphone/iphone-16-pro-max-review,"Motorola Phones Motorola Razr Ultra 2025 review : the cure for the common smartphone ... When you purchase through links on our site, we may earn an affiliate commission. Here’s how it works. ... The Apple iPhone 16 Pro Max is bigger and more powerful than ever. This is big"
i phone 16 pro max,gadgets360.com,https://www.gadgets360.com/mobiles/reviews/iphone-16-pro-max-review-6702737,29 Oct 2024 — iPhone 16 Pro Max · Good · Massive screen size · Brilliant display · Performance beast · Camera Control is a boon · Fantastic battery life. Bad ...
Motorola Hi Res Audio,gsmarena.com,https://www.gsmarena.com/motorola-phones-4.php,Motorola Moto G Power - 2025 | Unlocked | Made for US 8/128GB | 50MP Camera | Slate Gray 128GB 8GB RAM $ 249.99 -16.3%
Motorola Hi Res Audio,gadgets360.com,https://www.gadgets360.com/service-centers/motorola/global-services-66958,"Aug 1, 2025 · Global Services Motorola Service Center in Amravati, Maharashtra - Global Services is an authorised service center of Motorola in Amravati. Find Global Services …"
Motorola Hi Res Audio,amazon.in,https://www.amazon.in/Motorola-Buds-Playback-Bluetooth-Wireless/dp/B0D4F4B2FK,It has a very good anc and which blocks all the outside sound and good fit. Deep bass but dont buy it. it's high costing and if u have old device you can't download its app. And if you have a great device than you can access dolby atmos sound great connection and buy it at rs 1999 on flipkart now.
Motorola Hi Res Audio,gadgets360.com,https://www.gadgets360.com/audio/reviews/moto-buds-plus-review-5914478,"Jun 18, 2024 · They offer a battery life of up to 38 hours, support Dolby Head Tracking technology alongside Hi - Res Audio certification and an enhanced music experience with ‘Sound by Bose.’ I have spent the past few days using the Moto Buds+, so let’s discuss the plusses and the noughts."
i phoine 14 pro max,tomsguide.com,https://www.tomsguide.com/reviews/iphone-14-pro-max,"10 Mar 2023 — The iPhone 14 Pro Max's clever Dynamic Island, powerful cameras, always-on display and super long battery life make it the best phone money can buy."
i phoine 14 pro max,techradar.com,https://www.techradar.com/reviews/iphone-14-pro-max-review,"Why you can trust TechRadar We spend hours testing every product or service we review , so you can be sure you're buying the best. Find out more about how we test. ... Ahead of launch, we ran an informal Twitter poll on which new Apple iPhone 14 people wanted. The iPhone 14 Pro Max was the clear ... The biggest and best of everything in an iPhone"
i phoine 14 pro max,gsmarena.com,https://www.gsmarena.com/apple_iphone_14_pro_max-11773.php,"Apple iPhone 14 Pro Max smartphone. Announced Sep 2022. Features 6.7″ display, Apple A16 Bionic chipset, 4323 mAh battery, 1024 GB storage, 6 GB RAM, Ceramic Shield glass."
i phoine 14 pro max,gadgets360.com,https://www.gadgets360.com/mobiles/reviews/iphone-14-pro-review-price-india-dynamic-island-a16-bionic-48-megapixel-camera-performance-3432554,15 Oct 2022 — Good · Superb display with always-on mode · Excellent overall performance · Good battery life · All cameras take high-quality stills and video ...
