Product,Site,URL,Review
samsung s24,techradar.com,https://www.techradar.com/phones/samsung-galaxy-phones/samsung-galaxy-s24-review,"The Samsung Galaxy S24 is a great choice for Android fans, with exceptional battery life, top-notch performance, and a sleek design that can stand up to some abuse. It’s got almost enough... Feb 2, 2024 · It has an equally beautiful display, the same class-leading processor, long battery life, and AI features that go beyond parlor tricks. It also shares the same top-notch build quality and... Jan 31, 2024 · At the end of the day, the Galaxy S24 and S24 Plus have great battery life, impressive performance, seven years of software support and some of its Galaxy AI features show promise, but I... Jan 22, 2025 · Samsung hasn't change a lot with the Galaxy S24 , but has updated the formula with cutting-edge AI features and seven years of updates. Still priced at a competitive $799, the Galaxy S24 is... Feb 2, 2024 · My Samsung Galaxy S24 review will look at the Galaxy AI features, of course, and whether they make the most affordable model in Samsung 's flagship lineup worth a purchase or upgrade. Aug 25, 2025 · The Samsung Galaxy S24 combines a fast processor, a bright display, sharp cameras, and helpful AI tools in a pocket-friendly size for a reasonable price. By PCMag on February 06, 2024 Is the Samsung Galaxy S24 a good phone? At the end of the day, the Galaxy S24 and S24 Plus have great battery life, impressive performance , seven years of software support and some of its Galaxy AI features show promise, but I expect more from the S24 Plus' camera given its $1,000 price. Every phone tested by CNET's reviews team is actually used in the real world. Is the Samsung Galaxy S24 worth buying? The Galaxy S24 delivers some of the strongest value of Samsung’s latest flagships, offering the same Galaxy AI features as its pricier counterparts. Is the Samsung Galaxy S24 better than the Galaxy S23? The Galaxy S24 is the same price as the Galaxy S23, but you get more battery, better performance , and seven years of Android updates this time, so the value is stronger. Admittedly it looks like an iPhone, but it’s also small, light, and thin enough to slip into a front pocket with ease. How long does the Samsung Galaxy S24 last? The Galaxy S24 held out for 13 hours and 28 minutes , with its display set to the default adaptive refresh rate. That's not only 3.5 hours better than the average smartphone's battery test time, it also tops the 10-hour, 27-minute time recorded by the Galaxy S23. What's the difference between galaxy S24 & S24 ultra? There are bottlenecks with both. The Galaxy S24 Ultra technically outperformed the Galaxy S24 , likely due to the extra RAM on board. The Galaxy S24 only ships with 8GB of RAM installed, while the S24 Ultra comes with 12GB. Does the Galaxy S24 have a benchmark? The Galaxy S24 was benchmarked in Future Labs by our resident benchmarking expert, and results were shared and discussed with review editors. Benchmarks do not affect review scores in any way, and are helpful for comparison but not for real-world review purposes. Mar 17, 2024 · Samsung Galaxy S24 Review : Best Compact Phone of the Year? Here's our Samsung Galaxy S24 review , where we break down the overall smartphone for you. backmarket.com has been visited by 10K+ users in the past month Find a refurbished Galaxy S24 deal that's better for your wallet and the planet. 1-year warranty, 30-day returns, free standard shipping. Find the best offers. Money Back Guarantee · 1-Year Warranty · 100% Sustainable Devices · 30-day returns Service catalog : Free Shipping, Free 1-Year Warranty, Certified Merchants"
samsung s24,gadgets360.com,https://www.gadgets360.com/mobiles/reviews/galaxy-s24-review-5235620,"March 17, 2024 - The panel is protected by Gorilla Glass Victus 2. Apart from a slightly bigger panel and a higher screen-to-body ratio, the Galaxy S24 once again looks very similar to the Galaxy S23. As for specifications, we have something quite interesting under the hood this year. Samsung bravely opted for its own silicon, with the Exynos 2400 SoC, which is paired with its Xclipse 940 GPU. After several years of going with Qualcomm silicon we don't think it is a good idea. But this is better explained in the performance section of this review."
samsung s24,tomsguide.com,https://www.tomsguide.com/phones/samsung-phones/i-review-phones-for-a-living-and-the-galaxy-s24-is-the-first-truly-great-samsung-flagship-ive-tested,"February 5, 2024 - Yes, the Galaxy AI features Samsung has added help elevate the Galaxy S24 in my eyes. In my testing, Notes auto-formatting and summary features performed particularly well, and Circle to Search is already my favorite addition to the Galaxy's toolset."
samsung s24,tomsguide.com,https://www.tomsguide.com/reviews/samsung-galaxy-s24,"Feb 2, 2024 · My Samsung Galaxy S24 review will look at the Galaxy AI features, of course, and whether they make the most affordable model in Samsung 's flagship lineup worth a purchase or upgrade. Aug 25, 2025 · The Samsung Galaxy S24 combines a fast processor, a bright display, sharp cameras, and helpful AI tools in a pocket-friendly size for a reasonable price. By PCMag on February 06, 2024 Is the Samsung Galaxy S24 a good phone? At the end of the day, the Galaxy S24 and S24 Plus have great battery life, impressive performance , seven years of software support and some of its Galaxy AI features show promise, but I expect more from the S24 Plus' camera given its $1,000 price. Every phone tested by CNET's reviews team is actually used in the real world. Is the Samsung Galaxy S24 worth buying? The Galaxy S24 delivers some of the strongest value of Samsung’s latest flagships, offering the same Galaxy AI features as its pricier counterparts. Is the Samsung Galaxy S24 better than the Galaxy S23? The Galaxy S24 is the same price as the Galaxy S23, but you get more battery, better performance , and seven years of Android updates this time, so the value is stronger. Admittedly it looks like an iPhone, but it’s also small, light, and thin enough to slip into a front pocket with ease. How long does the Samsung Galaxy S24 last? The Galaxy S24 held out for 13 hours and 28 minutes , with its display set to the default adaptive refresh rate. That's not only 3.5 hours better than the average smartphone's battery test time, it also tops the 10-hour, 27-minute time recorded by the Galaxy S23. What's the difference between galaxy S24 & S24 ultra? There are bottlenecks with both. The Galaxy S24 Ultra technically outperformed the Galaxy S24 , likely due to the extra RAM on board. The Galaxy S24 only ships with 8GB of RAM installed, while the S24 Ultra comes with 12GB. Does the Galaxy S24 have a benchmark? The Galaxy S24 was benchmarked in Future Labs by our resident benchmarking expert, and results were shared and discussed with review editors. Benchmarks do not affect review scores in any way, and are helpful for comparison but not for real-world review purposes. Mar 17, 2024 · Samsung Galaxy S24 Review : Best Compact Phone of the Year? Here's our Samsung Galaxy S24 review , where we break down the overall smartphone for you."
samsung s24,gsmarena.com,https://www.gsmarena.com/samsung_galaxy_s24-review-2663p6.php,"Feb 1, 2024 · The MSRP for a vanilla Galaxy S24 will vary from region to region, and you can get different carrier and vendor deals and bundles. The most popular tier..."
samsung s24,gsmarena.com,https://www.gsmarena.com/samsung_galaxy_s24-review-2663.php,"The Galaxy S24 series has finally launched after numerous rumors, speculations and daily leaks. And the trio is what we expected - a solid but incremental..."
samsung s24,flipkart.com,https://www.flipkart.com/samsung-galaxy-s24-5g-onyx-black-256-gb/product-reviews/itm0456c01739016?pid=MOBGX2F3ZUBMWBGP,Review after 1 month using.. Heating issue . Camera good. Battery decent Charging fast Look is good.
